"","TI","SO","LeadAuthorFirst","LeadAuthorLast","LeadInitOnly","first.gender.manual","first.gender","first.gender.manual.method","EditorFirst","EditorLast","editor.gender.manual","FirstInst2","Editor.Institution"
"617","Competitor relatedness, indirect soil effects and plant coexistence","JOURNAL OF ECOLOGY","Bodil","jones","no","female",NA,"babynamewizard.com","Scott","Wilson","male","CNRS Center for Ecological Function and Evolution","University of Regina"
"618","Predicting changes in the distribution and abundance of species under environmental change","ECOLOGY LETTERS","Johan","selwood","no","male","male","","Yvonne","Buckley","female","Stockholm University","Trinity College Dublin"
"619","Advancing environmentally explicit structured population models of plants","JOURNAL OF ECOLOGY","Johan","arnan","no","male","male","","Alden","Griffith","male","Stockholm University","Wellesley College"
"620","Trade-offs between physical and chemical carbon-based leaf defence: of intraspecific variation and trait evolution","JOURNAL OF ECOLOGY","David","guevara","no","male","male","","Amy","Austin","female","University of Halle Wittenberg","University of Buenos Aires"
"621","Identifying consumer-resource population dynamics using paleoecological data","ECOLOGY","Arni","saupe","no","male",NA,"babynamewizard.com","Brian","Inouye","male","Myvatn Research Station","Florida State University"
"622","Climate-driven extinctions shape the phylogenetic structure of temperate tree floras","ECOLOGY LETTERS","Wolf","thorson","no","male","male","","Helene","Morlon","female","Aarhus University","CNRS"
"623","Late Cenozoic climate and the phylogenetic structure of regional conifer floras world-wide","GLOBAL ECOLOGY AND BIOGEOGRAPHY","Wolf","crone","no","male","male","","Jeremy","Kerr","male","Aarhus University","University of Ottawa"
"624","A bird's eye view of a deleterious recessive allele","JOURNAL OF ANIMAL ECOLOGY","Robert","ehrlen","no","male","male","","Graeme","Hays","male","Uppsala University","Deakin University"
"625","Spatial overlap in a solitary carnivore: support for theland tenure, kinship or resource dispersion hypotheses?","JOURNAL OF ANIMAL ECOLOGY","L.","mcdonald","no","male","male","","Anne","Loison","female","Panthera","Universite de Savoie"
"626","Quantifying demographic uncertainty: Bayesian methods for integral projection models","ECOLOGICAL MONOGRAPHS","Bret","needham","no","male","male","","Thom","Hobbs","male","Louisiana State University","Colorado State University"
"627","The role of a dominant predator in shaping biodiversity over space and time in a marine ecosystem","JOURNAL OF ANIMAL ECOLOGY","Kari","del campo","no","female","female","","Anna","Kuparinen","female","Norwegian Institute of National Research","University of Helsinki"
"628","Using multiple imputation to estimate missing data in meta-regression","METHODS IN ECOLOGY AND EVOLUTION","E.","anderson","no",NA,NA,"","Jarrod","Hadfield",NA,"Trent University","University of Edinburgh"
"629","Experimental evidence for within- and cross-seasonal effects of fear on survival and reproduction","JOURNAL OF ANIMAL ECOLOGY","Kyle","belmaker","no","either","either","","Ben","Dantzer","male","University of Guelph","University of Michigan"
"630","Ecology in an anthropogenic biosphere","ECOLOGICAL MONOGRAPHS","Erle","boucher-lalonde","no","female",NA,"behindthename.com","Aaron","Ellison","male","","Harvard Forest"
"631","rSPACE: Spatially based power analysis for conservation and ecology","METHODS IN ECOLOGY AND EVOLUTION","Martha","feldman","no","female","female","","Timothee","Poisot","male","USFS Rocky Mountain Research Station","University of Canterbury"
"632","Untitled","ECOLOGICAL MONOGRAPHS","Aaron","godet","no","male","male","","Aaron","Ellison","male","","Harvard Forest"
"633","How to quantify the temporal storage effect using simulations instead of math","ECOLOGY LETTERS","Stephen","gonzalez","no","male","male","","Jessica","Metcalfe","female","Cornell University","Princeton University"
"634","Community structure influences species' abundance along environmental gradients","JOURNAL OF ANIMAL ECOLOGY","Antti","jarzyna","no","male",NA,"babynamewizard.com","Martin","Genner","male","Norwegian Institute of Nature Research Trondheim","University of Bristol"
"635","A Parent-of-Origin Effect Impacts the Phenotype in Low Penetrance Retinoblastoma Families Segregating the c.1981C > T/p.Arg661Trp Mutation of RB1","PLOS GENETICS","Philippine","somveille","no","female","female","","Sharon","Plon","female","Institute Curie","Baylor College of Medicine"
"636","Connecting Circadian Genes to Neurodegenerative Pathways in Fruit Flies","PLOS GENETICS","Patrick","wilber","no","male","male","","Paul","Taghert","male","","Washington University Medical School"
"637","Exome Sequencing of Phenotypic Extremes Identifies CAV2 and TMC6 as Interacting Modifiers of Chronic Pseudomonas aeruginosa Infection in Cystic Fibrosis","PLOS GENETICS","Mary","knape","no","female","female","","Christine","Wells","female","University of Washington","University of Queensland"
"638","Eutrophication triggers contrasting multilevel feedbacks on litter accumulation and decomposition in fens","ECOLOGY","W.","bennett","no",NA,NA,"","Joseph","Yavitt","male","University of Antwerp","Cornell University"
"639","Divergent evolution in antiherbivore defences within species complexes at a single Amazonian site","JOURNAL OF ECOLOGY","Maria-Jose","dambros","no","female",NA,"first name alone","Walter","Carson","male","University of Utah","University of Pittsburgh"
"640","Signatures of Evolutionary Adaptation in Quantitative Trait Loci Influencing Trace Element Homeostasis in Liver","MOLECULAR BIOLOGY AND EVOLUTION","Johannes","morales","no","male","male","","Connie","Mulligan","either","University Pompeu Fabra","University of Florida"
"641","Erosion of beta diversity under interacting global change impacts in a semi-arid grassland","JOURNAL OF ECOLOGY","Anu","xu","no","female",NA,"behindthename.com","Susan","Schwinning","female","University of California Davis","Texas State University"
"642","Herbivory mediates the long-term shift in the relative importance of microsite and propagule limitation","JOURNAL OF ECOLOGY","Anu","bellingham","no","female",NA,"behindthename.com","Stephen","Bonser","male","University of Oulu","University of New South Wales"
"643","Parallel selective pressures drive convergent diversification of phenotypes in pythons and boas","ECOLOGY LETTERS","Damien","cirtwill","no","male","male","","Luke","Harmon","male","Australian National University","University of Idaho"
"644","Biological Flora of the British Isles: Ambrosia artemisiifolia","JOURNAL OF ECOLOGY","Franz","dalziell","no","male","male","","",NA,NA,"University of Vienna",""
"645","Species' intrinsic traits inform their range limitations and vulnerability under environmental change","GLOBAL ECOLOGY AND BIOGEOGRAPHY","Alba","drake","yes","female",NA,"babynames.com","Antoine","Guisan","male","University of Evora","University of Lausanne"
"646","NLMpy: a PYTHON software package for the creation of neutral landscape models within a general numerical framework","METHODS IN ECOLOGY AND EVOLUTION","Thomas","farrell","no","male","male","","Timothee","Poisot","male","Auckland University of Technology","University of Canterbury"
"647","How reliably can we infer diversity-dependent diversification from phylogenies?","METHODS IN ECOLOGY AND EVOLUTION","Rampal","faye","no",NA,NA,"","Kate","Jones","female","University of Groningen","University College London"
"648","Fire evolution in the radioactive forests of Ukraine and Belarus: future risks for the population and the environment","ECOLOGICAL MONOGRAPHS","N.","gorsich","no",NA,NA,"","Aimee","Classen","female","Institute Pierre & Simon Laplace","University of Tennessee"
"649","Multiple Loci and Complete Taxonomic Sampling Resolve the Phylogeny and Biogeographic History of Tenrecs (Mammalia: Tenrecidae) and Reveal Higher Speciation Rates in Madagascar's Humid Forests","SYSTEMATIC BIOLOGY","Kathryn","han","no","female","female","","Erika","Edwards","female","University of Alaska Museum","Brown University"
"650","Environmental changes define ecological limits to species richness and reveal the mode of macroevolutionary competition","ECOLOGY LETTERS","Thomas","henry","no","male","male","","Helene","Morlon","female","University of Southampton","CNRS"
"651","EcoVeg: a new approach to vegetation description and classification (vol 84, pg 533, 2014)","ECOLOGICAL MONOGRAPHS","D.","ilany","no",NA,NA,"","","",NA,"",""
"652","Colonisation rate and adaptive foraging control the emergence of trophic cascades","ECOLOGY LETTERS","Ashkaan","inman-narahari","no","male",NA,"babycenter.com","Tim","Wootton","either","University of California Riverside","University of Chicago"
"653","Density-dependent habitat selection of spawning Chinook salmon: broad-scale evidence and implications","JOURNAL OF ANIMAL ECOLOGY","Matthew","jepsen","no","male","male","","Martin","Genner","male","","University of Bristol"
"654","plant: A package for modelling forest trait ecology and evolution","METHODS IN ECOLOGY AND EVOLUTION","Daniel","knie","no","either","either","","Sean","McMahon","either","Macquarie University","Smithsonian Environmental Research Center"
"655","A paradoxical mismatch between interspecific pollinator moves and heterospecific pollen receipt in a natural community","ECOLOGY","Qiang","koerner","no",NA,NA,"","Randall","Mitchell","male","Henan University of Science and Technology","University of Akron"
"656","Functional breadth and home-field advantage generate functional differences among soil microbial decomposers","ECOLOGY","Nicolas","krzyzanowski","no","male","male","","Steven","Allison","male","","University of California Irvine"
"657","Bottom-up and top-down human impacts interact to affect a protected coastal Chilean marsh","ECOLOGY","Jose","lamanna","no","male","male","","Brenda","Grewell","female","Pontifician University Catolica Chile","University of California Davis"
"658","Constructing, conducting and interpreting animal social network analysis","JOURNAL OF ANIMAL ECOLOGY","Damien","nadeau","no","male","male","","Sonia","Altizer","female","University of Oxford","University of Georgia"
"659","Terrestrial support of aquatic food webs depends on light inputs: a geographically-replicated test using tank bromeliads","ECOLOGY","Vinicius","proud","no",NA,NA,"","Evan","Preisser","male","University Federal Rio de Janeiro","University of Rhode Island"
"660","The path to host extinction can lead to loss of generalist parasites","JOURNAL OF ANIMAL ECOLOGY","Maxwell","romiguier","no","male","male","","Andrew","Fenton","male","McGill University","University of Liverpool"
"661","Response to Strona & Fattorini: are generalist parasites being lost from their hosts?","JOURNAL OF ANIMAL ECOLOGY","Maxwell","tenow","no","male","male","","Andy","Fenton","either","McGill University","University of Liverpool"
"662","Indirect effects of global change accumulate to alter plant diversity but not ecosystem function in alpine tundra","JOURNAL OF ECOLOGY","Emily","uno","no","female","female","","Sandra","Lavorel","female","University of California Berkeley","CNRS"
"663","Teasing apart plant community responses to N enrichment: the roles of resource limitation, competition and soil microbes","ECOLOGY LETTERS","Emily","voutilainen","no","female","female","","Johannes","Knops","male","Tulane University","University of Nebraska"
"664","Strong effects of variation in taxonomic opinion on diversification analyses","METHODS IN ECOLOGY AND EVOLUTION","Soren","xu","no","male",NA,"babynames.com","Liam","Revell","male","Aarhus University","University of Massachusetts Boston"
"665","The asymmetry in the Great American Biotic Interchange in mammals is consistent with differential susceptibility to mammalian predation","GLOBAL ECOLOGY AND BIOGEOGRAPHY","Soren","brown","no","male",NA,"babynames.com","Kathleen","Lyons","female","Museo Nacional de Ciencias Naturales","National Museum of Natural History Smithsonian Institution"
"666","Seasonal demography of a cyclic lemming population in the Canadian Arctic","JOURNAL OF ANIMAL ECOLOGY","Dominique","chen","no","either","either","","Rolf","Ims","male","Universite Laval","University of Tromso"
"667","Variation in the age of first reproduction: different strategies or individual quality?","ECOLOGY","Remi","halpin","no","either",NA,"babynames.com","Donald","Strong","male","University La Rochelle","University of California Davis"
"668","Population density and climate shape early-life survival and recruitment in a long-lived pelagic seabird","JOURNAL OF ANIMAL ECOLOGY","Remi","kirkman","yes","either",NA,"babynames.com","Thierry","Boulinier","male","University La Rochelle","CNRS"
"669","A toolbox for studying thermal heterogeneity across spatial scales: from unmanned aerial vehicle imagery tolandscape metrics","METHODS IN ECOLOGY AND EVOLUTION","Emile","peltier","no","male","male","","Andrew","Tatem","male","","University of Southampton"
"670","Experimentally testing and assessing the predictive power of species assembly rules for tropical canopy ants","ECOLOGY LETTERS","Tom","royo","no","male","male","","Ferenc","Jordan","male","Academy of Sciences of the Czech Republic","Wissenschaftskolleg zu Berlin"
"671","Round Spermatid Injection Rescues Female Lethality of a Paternally Inherited Xist Deletion in Mouse","PLOS GENETICS","Federica","sillett","no","female","female","","Antoine","Peters","male","University Medical Center at Erasmus Medical College","Friedrich Miescher Institute for Biomedical Research and University of Basel"
"672","Unravelling conflicting density- and distance-dependent effects on plant reproduction using a spatially explicit approach","JOURNAL OF ECOLOGY","Jose","turner","no","male","male","","Caroline","Brophy","female","Helmholz Center for Environmental Research","Maynooth University"
"673","Fertilization limitation of Diadema antillarum on coral reefs in the Florida Keys","ECOLOGY","Colette","catullo","no","female","female","","Richard","Aronson","male","Rutgers-State University of New Jersey","Florida Institute of Technology"
"674","Wild-Type U2AF1 Antagonizes the Splicing Program Characteristic of U2AF1-Mutant Tumors and Is Required for Cell Survival","PLOS GENETICS","Dennis","estrada","no","male","male","","Leighton","Grimes","male","","Cincinnati Children's Hospital Medical Center"
"675","The geography of snake reproductive mode: a global analysis of the evolution of snake viviparity","GLOBAL ECOLOGY AND BIOGEOGRAPHY","Anat","federici","no","male",NA,"babynamewizard.com","Miguel","Olalla-Tarraga","male","Tel Aviv University","University of Alcala"
"676","Body sizes and diversification rates of lizards, snakes, amphisbaenians and the tuatara","GLOBAL ECOLOGY AND BIOGEOGRAPHY","Anat","garcia","no","male",NA,"babynamewizard.com","",NA,NA,"Tel Aviv University",""
"677","A High-Coverage Yersinia pestis Genome from a Sixth-Century Justinianic Plague Victim","MOLECULAR BIOLOGY AND EVOLUTION","Michal","gillman","no","either","either","","Connie","Mulligan","either","Max Planck Institute of Sciences and Human History","University of Florida"
"678","Where does environmental stochasticity most influence population dynamics? An assessment along a regional core-periphery gradient for prairie breeding ducks","GLOBAL ECOLOGY AND BIOGEOGRAPHY","Richard","niamir","no","male","male","","Allen","Hurlbert","male","Trent University","University of North Carolina Chapel Hill"
"679","Nutrient enrichment intensifies hurricane impact in scrub mangrove ecosystems in the Indian River Lagoon, Florida, USA","ECOLOGY","Ilka","ralston","no","female","female","","Randy","Dahlgren","either","","University of California Davis"
"680","Exploring the universal ecological responses to climate change in a univoltine butterfly","JOURNAL OF ANIMAL ECOLOGY","Phillip","wang","no","male","male","","Jason","Chapman","male","University of Southampton","University of Exeter"
"681","Phylogenetic and functional mechanisms of direct and indirect interactions among alien and native plants (vol 104, pg 1136, 2016)","JOURNAL OF ECOLOGY","Y.","klein","no",NA,NA,"","",NA,NA,"",""
"682","Introduction history, climatic suitability, native range size, species traits and their interactions explain establishment of Chinese woody species in Europe","GLOBAL ECOLOGY AND BIOGEOGRAPHY","Yanhao","manceau","no",NA,NA,"","Erica","Fleischman","female","University of Konstanz","University of California Davis"
"683","Phylogenetic and functional mechanisms of direct and indirect interactions among alien and native plants","JOURNAL OF ECOLOGY","Yanhao","rosindell","no",NA,NA,"","Laura","Huenneke","female","University of Konstanz","Northern Arizona University"
"684","How does clay constrain woody biomass in drylands?","GLOBAL ECOLOGY AND BIOGEOGRAPHY","Roderick","title","no","male","male","","Josep","Penuelas","male","Queensland Herbarium","CREAF Universitat Autonoma Barcelona"
"685","Global-scale mapping of changes in ecosystem functioning from earth observation-based trends in total and recurrent vegetation","GLOBAL ECOLOGY AND BIOGEOGRAPHY","Rasmus","bowman","no","male",NA,"babynames.com","Josep","Penuelas","male","University of Copenhagen","CREAF Universitat Autonoma Barcelona"
"686","Occupancy models for data with false positive and false negative errors and heterogeneity across sites and surveys","METHODS IN ECOLOGY AND EVOLUTION","Paige","chuvieco","no","either","either","","Nigel","Yoccoz","male","University of Georgia","University of Tromso"
"687","Density-dependent productivity in a colonial vulture at two spatial scales","ECOLOGY","Dario","elliott","no","male","male","","John","Sauer","male","Estation Biological Donana","USGS Patuxent Wildlife Research Center"
"688","Disentangling the effect of competition, CO2 and climate on intrinsic water-use efficiency and tree growth","JOURNAL OF ECOLOGY","Laura","gonzalez-megias","no","female","female","","Charles","Canham","male","","Cary Institute of Ecosystem Studies"
"689","Towards a glacial-sensitive model of island biogeography","GLOBAL ECOLOGY AND BIOGEOGRAPHY","Jose","good","no","male","male","","Ana","Santos","female","University La Laguna","University of Alcala"
"690","Invariant Versus Classical Quartet Inference When Evolution is Heterogeneous Across Sites and Lineages","SYSTEMATIC BIOLOGY","Jesus","harvey","no","male","male","","Olivier","Gascuel","male","Universitat Politecnica de Catalunya","Institut Pasteur"
"691","Water-energy balance, past ecological perturbations and evolutionary constraints shape the latitudinal diversity gradient of soil testate amoebae in south-western South America","GLOBAL ECOLOGY AND BIOGEOGRAPHY","Leonardo","kiere","no","male","male","","Xiaofeng","Xu",NA,"University of Neuchatel","San Diego State University"
"692","Exploring Phylogenetic Relationships within Myriapoda and the Effects of Matrix Composition and Occupancy on Phylogenomic Reconstruction","SYSTEMATIC BIOLOGY","Rosa","losdat","no","female","female","","Brian","Wiegmann","male","Harvard University","Iowa State University"
"693","Phosphorus metabolism of reef organisms with algal symbionts","ECOLOGICAL MONOGRAPHS","Christine","murgiano","no","female","female","","Carol","Thornber","female","","University of Rhode Island"
"694","Thermal variability alters the impact of climate warming on consumer-resource systems","ECOLOGY","Samuel","paterson","no","male","male","","Lewi","Stone","male","Yale University","Tel Aviv University"
"695","Reproductive Mode and the Evolution of Genome Size and Structure in Caenorhabditis Nematodes","PLOS GENETICS","Janna","qiu","no","female","female","","Mark","Blaxter","male","University of Oregon","University of Edinburgh"
"696","Coevolutionary Landscape Inference and the Context-Dependence of Mutations in Beta-Lactamase TEM-1","MOLECULAR BIOLOGY AND EVOLUTION","Matteo","ripple","no","male","male","","Claus","Wilke","male","Universite Paris 06","University of Texas"
"697","Tree ring ecological signal is consistent with floristic composition and plant indicator values in Mediterranean Fagus sylvatica forests","JOURNAL OF ECOLOGY","Goffredo","sanders","no","male",NA,"behindthename.com","Frank","Gilliam","either","University of Tuscia","Marshall University"
"698","Regulation of Clostridium difficile Spore Formation by the SpoIIQ and SpoIIIA Proteins","PLoS Genetics","Kelly","santos","no","either","either","","Daniel","Kearns","either","University of Vermont","Indiana University"
"699","Does functional trait diversity predict above-ground biomass and productivity of tropical forests? Testing three alternative hypotheses","JOURNAL OF ECOLOGY","Bryan","thomsen","no","male","male","","Charles","Canham","male","CATIE","Cary Institute of Ecosystem Studies"
"700","Exotic or not, leaf trait dissimilarity modulates the effect of dominant species on mixed litter decomposition","JOURNAL OF ECOLOGY","Genevieve","gralka","no","female","female","","Rien","Aerts","male","Academy of Sciences of the Czech Republic","Vrije Universiteit"
"701","Effects of permafrost thaw on nitrogen availability and plant-soil interactions in a boreal Alaskan lowland","JOURNAL OF ECOLOGY","Rebecca","hill","no","female","female","","Nina","Wurzburger","female","University of Alaska Fairbanks","University of Georgia"
"702","Alignment of Homologous Chromosomes and Effective Repair of Programmed DNA Double-Strand Breaks during Mouse Meiosis Require the Minichromosome Maintenance Domain Containing 2 (MCMDC2) Protein","PLOS GENETICS","Friederike","veller","no","female","female","","Eva","Hoffmann","female","Technological University of Dresden","University of Sussex"
"703","Gametic interactions promote inbreeding avoidance in house mice","ECOLOGY LETTERS","Renee","ivanov","no","female","female","","David","Hosken","male","University of Western Australia","University of Exeter"
"704","A Comprehensive, High-Resolution Map of a Gene's Fitness Landscape (vol 31, pg 1581, 2014)","MOLECULAR BIOLOGY AND EVOLUTION","Elad","liu","no","male",NA,"babynames.com","","Errata",NA,"",NA
"705","Social carry-over effects underpin trans-seasonally linked structure in a wild bird population","ECOLOGY LETTERS","Josh","wang","no","male","male","","Gabriele","Sorci","male","University of Oxford","Universite de bourgogne"
"706","Response to commentary by Woinarski (Critical-weight-range marsupials in northern Australia are declining: a commentary on Fisher et al. (2014) 'The current decline of tropical marsupials in Australia: is history repeating?')","GLOBAL ECOLOGY AND BIOGEOGRAPHY","Diana","williams","no","female","female","","Erica","Fleischman","female","University of Queensland","University of California Davis"
"707","Bias correction in species distribution models: pooling survey and collection data for multiple species","METHODS IN ECOLOGY AND EVOLUTION","William","anderson","no","male","male","","Robert","O'Hara","male","Stanford University","Biodiversitat und Klima"
"708","The importance of plant genotype and contemporary evolution for terrestrial ecosystem processes","ECOLOGY","Connor","jacob","no","male","male","","Peter","Adler","male","University of Toronto","Utah State University"
"709","Ecological genomics meets community-level modelling of biodiversity: mapping the genomic landscape of current and future environmental adaptation","ECOLOGY LETTERS","Matthew","penk","no","male","male","","Mark","Vellend","male","University of Maryland","Universite de Sherbrooke"
"710","Locally adapted traits maintained in the face of high gene flow","ECOLOGY LETTERS","S.","tabak","no",NA,NA,"","Jane","Hill","female","Colorado State University","University of York"
"711","The DnaA Protein Is Not the Limiting Factor for Initiation of Replication in Escherichia coli","PLOS GENETICS","Ingvild","bennett","no",NA,NA,"","William","Burkholder","male","Oslo University Hospital","Agency for Science Technology and Research"
"712","Effects of host heterogeneity on pathogen diversity and evolution","ECOLOGY LETTERS","Arietta","duffy","yes","female",NA,"babynamewizard.com","Kevin","Lafferty","male","University of Chicago","USGS Chanel Islands Field Station"
"713","Estimating where and how animals travel: an optimal framework for path reconstruction from autocorrelated tracking data","ECOLOGY","C.","sunday","no",NA,NA,"","Nicholas","Gotelli","male","National Zoological Park Front Royal","University of Vermont"
"714","Unravelling the annual cycle in a migratory animal: breeding-season habitat loss drives population declines of monarch butterflies","JOURNAL OF ANIMAL ECOLOGY","D.","pellegrini","no",NA,NA,"","Tim","Coulson","either","University of Guelph","University of Oxford"
"715","BiMat: a MATLAB package to facilitate the analysis of bipartite networks","METHODS IN ECOLOGY AND EVOLUTION","Cesar","allstadt","no","male","male","","Greg","McInerny","male","Georgia Institute of Technology","University of Warwick"
"716","Genomic Imprinting in the Endosperm Is Systematically Perturbed in Abortive Hybrid Tomato Seeds","MOLECULAR BIOLOGY AND EVOLUTION","Ana","milcu","no","female","female","","Patricia","Wittkopp","female","Swiss Federal Institute of Technology","University of Michigan"
"717","Species Delimitation's Coming of Age","SYSTEMATIC BIOLOGY","Jean-Francois","prevedello","no","male","male","","",NA,NA,"",""
"718","The Phylogenetic Likelihood Library","SYSTEMATIC BIOLOGY","T.","catarino","no",NA,NA,"","Peter","Foster","male","Heidelberg University","University of Edinburgh"
"719","Ingression Progression Complexes Control Extracellular Matrix Remodelling during Cytokinesis in Budding Yeast","PLOS GENETICS","Magdalena","chanderbali","no","female","female","","Kathleen","Gould","female","University of Cantabria","Howard Hughes Medical Institute and Vanderbilt University School of Medicine"
