"","TI","SO","LeadAuthorFirst","LeadAuthorLast","LeadInitOnly","first.gender.manual","first.gender","first.gender.manual.method","EditorFirst","EditorLast","editor.gender.manual","FirstInst2","Editor.Institution"
"1","Ecology Letters, and Transparency and Openness Promotion (TOP) guidelines","ECOLOGY LETTERS",NA,"daniels","no",NA,NA,"","",NA,NA,"",""
"2","The relative importance of trait vs. genetic differentiation for the outcome of interactions among plant genotypes","ECOLOGY","Jessica","hoareau","no","female","female","","Jonathan","Grabowski","male","University of California Davis","Northeastern University"
"3","Test of biotic and abiotic correlates of latitudinal variation in defences in the perennial herb Ruellia nudiflora","JOURNAL OF ECOLOGY","Luis","morard","no","male","male","","Jennifer","Lau","female","Universidad Autonoma de Yucatan","Michigan State University"
"4","Multi-trophic consequences of plant genetic variation in sex andgrowth","ECOLOGY","Luis","soul","no","male","male","","James","Cronin","male","Universidad Autonoma de Yucatan","Louisiana State University"
"5","Parameterisation and validation of a resource budget model for masting using spatiotemporal flowering data of individual trees","ECOLOGY LETTERS","Tomoyuki","farrell","no",NA,NA,"","Liza","Comita","female","","Yale University"
"6","An Efficient Independence Sampler for Updating Branches in Bayesian Markov chain Monte Carlo Sampling of Phylogenetic Trees","SYSTEMATIC BIOLOGY","Andre","grogan","no","male","male","","Peter","Foster","male","Heidelberg University","University of Edinburgh"
"7","The many potential indirect interactions between predators that share competing prey","ECOLOGICAL MONOGRAPHS","Peter","henrichs","no","male","male","","Brian","Inouye","male","University of Toronto","Florida State University"
"8","Evaluating modularity in morphometric data: challenges with the RV coefficient and a new test measure","METHODS IN ECOLOGY AND EVOLUTION","Dean","klemme","no","male","male","","Pedro","Peres-Neto","male","Iowa State University","Concordia University Montreal"
"9","Distribution, demography and dispersal model of spatial spread of invasive plant populations with limited data","METHODS IN ECOLOGY AND EVOLUTION","Vanessa","skelton","no","female","female","","Mark","Rees","male","Charles Darwin University","University of Sheffield"
"10","Native fungal endophytes suppress an exotic dominant and increase plant diversity over small and large spatial scales","ECOLOGY","Michelle","strona","no","female","female","","Jason","Hoeksema","male","University of Miami","University of Mississippi"
"11","On the study of plant defence and herbivory using comparative approaches: how important are secondary plant compounds","ECOLOGY LETTERS","Anurag","zemunik","no","male","male","","Christoph","Scherber","male","Cornell University","Universitat Munster"
"12","Confidence intervals for ratios of proportions: implications for selection ratios","METHODS IN ECOLOGY AND EVOLUTION","Ken","meseguer","no","male","male","","Holger","Schielzeth","male","Idaho State University","Friedrich Schiller University of Jena"
"13","Rarity and Incomplete Sampling in DNA-Based Species Delimitation","SYSTEMATIC BIOLOGY","Dirk","patino","no","male","male","","Mark","Fishbein","male","Zoological Forschungsmuseum Alexander Koenig Bonn","Oklahoma State University"
"14","Context-dependent changes in the functional composition of tree communities along successional gradients after land-use change","JOURNAL OF ECOLOGY","Masahiro","roalson","no",NA,NA,"","David","Edwards","male","Tohoku University","University of Sheffield"
"15","Host contact and shedding patterns clarify variation in pathogen exposure and transmission in threatened tortoise Gopherus agassizii: implications for disease modelling and management","JOURNAL OF ANIMAL ECOLOGY","Christina","griffith","no","female","female","","Ian","Montgomery","male","Penn State","Queen's University Belfast"
"16","The phylogenetic structure of plant-pollinator networks increases with habitat size and isolation","ECOLOGY LETTERS","Marcelo","oken","no","male","male","","Jennifer","Dunne","female","University Nacional Comahue","Santa Fe institute"
"17","Flying with the winds: differential migration strategies in relation to winds in moth and songbirds","JOURNAL OF ANIMAL ECOLOGY","Susanne","sardans","no","female","female","","Graeme","Hays","male","Lund University","Deakin University"
"18","Disentangling the heritable and plastic components of the competitive and facilitative effects of an alpine foundation species","JOURNAL OF ECOLOGY","Patrick","gerber","no","male","male","","Marina","Semchenko","female","University of Bordeaux","University of Tartu"
"19","Climate change, species range shifts and dispersal corridors: an evaluation of spatial conservation models","METHODS IN ECOLOGY AND EVOLUTION","Diogo","classen","no","male",NA,"babynames.com","Barbara","Anderson","female","University of Evora","Landcare Research, Lincoln University"
"20","Strategies for a successful plant invasion: the reproduction of Phragmites australis in north-eastern North America","JOURNAL OF ECOLOGY","Arnaud","frick","no","male",NA,"babynames.com","Peter","Alpert","male","Universite Montreal","University of Massachusetts Amherst"
"21","Fast fitting of non-Gaussian state-space models to animal movement data via Template Model Builder","ECOLOGY","Christoffer","bieli","no","male",NA,"babynames.com","Elizabeth","Holmes","female","Technological University of Denmark","NOAA"
"22","Variation in neighbourhood context shapes frugivore-mediated facilitation and competition among co-dispersed plant species","JOURNAL OF ECOLOGY","Joerg","cerny","no","male",NA,"pronouncenames","Mark","Rees","male","University of Marburg","University of Sheffield"
"23","Quantifying Age-dependent Extinction from Species Phylogenies","SYSTEMATIC BIOLOGY","Helen","johnson","no","female","female","","Edward","Susko","male","ETH Zurich","Dalhousie University"
"24","Area, climate heterogeneity, and the response of climate niches to ecological opportunity in island radiations of Anolis lizards","GLOBAL ECOLOGY AND BIOGEOGRAPHY","Adam","mavromatakis","no","male","male","","Robert","Ricklefs","male","University of Nottingham","University of Missouri Saint Louis"
"25","Source of CpG Depletion in the HIV-1 Genome","MOLECULAR BIOLOGY AND EVOLUTION","Hamid","mencarelli","no","male","male","","Thomas","Leitner","male","University of New South Wales","Los Alamos National Laboratory"
"26","Land use intensification alters ecosystem multifunctionality via loss of biodiversity and changes to functional composition","ECOLOGY LETTERS","Eric","brucato","no","male","male","","Johannes","Knops","male","University of Bern","University of Nebraska"
"27","Plant biodiversity effects in reducing fluvial erosion are limited to low species richness","ECOLOGY","Daniel","engelken","no","either","either","","Steven","Pennings","male","Arizona State University","University of Georgia Marine Institute"
"28","Synthesis: comparing effects of resource and consumer fluxes into recipient food webs using meta-analysis","ECOLOGY","Daniel","feldman","no","either","either","","Elizabeth","Borer","female","Arizona State University","University of Minnesota"
"29","The importance of motivation, weapons, and foul odors in driving encounter competition in carnivores","ECOLOGY","Maximilian","hanghoj","no","male","male","","Elizabeth","Borer","female","University of California Santa Cruz","University of Minnesota"
"30","Biogeochemical implications of biodiversity and community structure across multiple coastal ecosystems","ECOLOGICAL MONOGRAPHS","Jacob","melin","no","male","male","","Nathan","Kraft","male","North Carolina State University","University of Maryland"
"31","Temporal variation in the synchrony of weather and its consequences for spatiotemporal population dynamics","ECOLOGY","Andrew","mendizabal","no","male","male","","Bradley","Cardinale","male","University of Virginia","University of Michigan"
"32","Social living mitigates the costs of a chronic illness in a cooperative carnivore","ECOLOGY LETTERS","E.","heard","no",NA,NA,"","Marco","Festa-Bianchet","male","Penn State","University of Sherbrooke"
"33","Fish community reassembly after a coral mass mortality: higher trophic groups are subject to increased rates of extinction","ECOLOGY LETTERS","David","hefley","no","male","male","","David","Mouillot","male","","Universite de Montpellier"
"34","Phenological response of a key ecosystem function to biological invasion","ECOLOGY LETTERS","Maria","auer","no","female","female","","Robert","Sterner","male","University of Toulouse 3","University of Minnesota Duluth"
"35","A simple Bayesian method of inferring extinction: reply","ECOLOGY","John","bishop","no","male","male","","",NA,NA,"Macquarie University",""
"36","Big answers from small worlds: a user's guide for protist microcosms as a model system in ecology and evolution","METHODS IN ECOLOGY AND EVOLUTION","Florian","brown","no","male","male","","Matthew","Spencer","male","Eawag Swiss Federal Institute of Aquatic Sciences & Technology","University of Otago"
"37","Host and parasite thermal acclimation responses depend on the stage of infection","JOURNAL OF ANIMAL ECOLOGY","Karie","corwin","no","female","female","","Jason","Tylianakis","male","Oakland University","University of Canterbury"
"38","Spatially explicit summary statistics for historical population genetic inference","METHODS IN ECOLOGY AND EVOLUTION","Diego","das","no","male","male","","Robert","Freckleton","male","CUNY City College","University of Sheffield"
"39","Long-Distance Dispersal Shaped Patterns of Human Genetic Diversity in Eurasia","MOLECULAR BIOLOGY AND EVOLUTION","Isabel","daskin","no","female","female","","Naruya","Saitou",NA,"University of Bern","National Institute of Genetics"
"40","Effects of temperature on consumer-resource interactions","JOURNAL OF ANIMAL ECOLOGY","Priyanga","duncan","no",NA,NA,"","Tim","Coulson","either","","University of Oxford"
"41","Migratory connectivity and effects of winter temperatures on migratory behaviour of the European robin Erithacus rubecula: a continent-wide analysis","JOURNAL OF ANIMAL ECOLOGY","Roberto","fimlaid","no","male","male","","Jean-Michel","Gaillard","male","University Milano Bicocca","CNRS"
"42","Mating-Induced Increase in Germline Stem Cells via the Neuroendocrine System in Female Drosophila","PLOS GENETICS","Tomotsune","foss-grant","no",NA,NA,"","Liliane","Schoofs","female","University of Tsukuba","Katholieke Universiteit Leuven"
"43","Land-use legacies rather than climate change are driving the recent upward shift of the mountain tree line in the Pyrenees","GLOBAL ECOLOGY AND BIOGEOGRAPHY","Aitor","gamba","no","male",NA,"babynamewizard.com","Martin","Sykes","male","University of Quebec","Lund University"
"44","DAF-16 and TCER-1 Facilitate Adaptation to Germline Loss by Restoring Lipid Homeostasis and Repressing Reproductive Physiology in C. elegans","PLOS GENETICS","Francis","heberling","yes","either","either","","Kaveh","Ashrafi","male","University of Pittsburgh","University of California San Francisco"
"45","Trophic interactions determine the effects of drought on an aquatic ecosystem","ECOLOGY","Sarah","iwanami","no","female","female","","Leon","Lounibos","male","University of British Columbia","University of Florida"
"46","Indirect effects of predators control herbivore richness and abundance in a benthic eelgrass (Zostera marina) mesograzer community","JOURNAL OF ANIMAL ECOLOGY","Sarah","jiang","yes","female","female","","Eoin","O'Gorman","male","University of British Columbia","Imperial College London"
"47","Ecological similarity is related to phylogenetic distance between species in a cross-niche field transplant experiment","ECOLOGY","Brian","kampf","no","male","male","","","",NA,"University of California Davis",""
"48","Identification of Novel Genetic Determinants of Erythrocyte Membrane Fatty Acid Composition among Greenlanders","PLOS GENETICS","Mette","kobayashi","no","female",NA,"babynames.com","Eleftheria","Zeggini","female","University of Copenhagen","Wellcome Trust Sanger Institute"
"49","Review of rope-based access methods for the forest canopy: safe and unsafe practices in published information sources and a summary of current methods","METHODS IN ECOLOGY AND EVOLUTION","David","kuo","no","male","male","","Robert","Freckleton","male","Peregrine Fund","University of Sheffield"
"50","Measures of precision for dissimilarity-based multivariate analysis of ecological communities","ECOLOGY LETTERS","Marti","lajoie","no","female","female","","Jonathan","Chase","male","Massey University","University of Leipzig"
"51","A Multistate Toggle Switch Defines Fungal Cell Fates and Is Regulated by Synergistic Genetic Cues","PLOS GENETICS","Matthew","levey","no","male","male","","Alexander","Idnurm","male","Brown University","University of Melbourne"
"52","Top predators and habitat complexity alter an intraguild predation module in pond communities","JOURNAL OF ANIMAL ECOLOGY","Thomas","patrick","no","male","male","","Eoin","O'Gorman","male","University of Missouri","Imperial College London"
"53","Non-additive effects of intra- and interspecific competition between two larval salamanders","JOURNAL OF ANIMAL ECOLOGY","Thomas","pintor","no","male","male","","Blaine","Griffen","male","University of Missouri","University of South Carolina"
"54","An analysis of methodological and spatial differences in global cropping systems models and maps","GLOBAL ECOLOGY AND BIOGEOGRAPHY","Weston","reck","no","male","male","","Martin","Sykes","male","","Lund University"
"55","Articulating ""Archiannelids"": Phylogenomics and Annelid Relationships, with Emphasis on Meiofaunal Taxa","MOLECULAR BIOLOGY AND EVOLUTION","Sonia","stock","no","female","female","","Nicolas","Vidal","male","Harvard University","Museum National d'Histoire Naturelle"
"56","Can genetically based clines in plant defence explain greaterherbivory at higher latitudes?","ECOLOGY LETTERS","Daniel","taylor","no","either","either","","Ted","Turlings","either","University of Toronto","University of Neuchatel"
"57","Embryonic Stem Cell (ES)-Specific Enhancers Specify the Expression Potential of ES Genes in Cancer","PLOS GENETICS","Dvir","uno","no","either",NA,"allhebrewnames.com","Jennifer","Mitchell","female","Hebrew University of Jerusalem","University of Toronto"
"58","Heat Freezes Niche Evolution (vol 16, pg 1206, 2013)","ECOLOGY LETTERS","Miguel","vizentin-bugoni","no","male","male","","",NA,NA,"",""
"59","A shady business: pine afforestation alters the primary controls on litter decomposition along a precipitation gradient in Patagonia, Argentina","JOURNAL OF ECOLOGY","Patricia","wang","no","female","female","","Richard","Bardgett","male","University of Buenos Aires","University of Manchester"
"60","An approach to estimate short-term, long-term and reaction norm repeatability","METHODS IN ECOLOGY AND EVOLUTION","Yimen","xu","no",NA,NA,"","Robert","O'Hara","male","Max Planck Institute of Ornithology","Biodiversitat und Klima"
"61","Reciprocal Effects on Neurocognitive and Metabolic Phenotypes in Mouse Models of 16p11.2 Deletion and Duplication Syndromes","PLOS GENETICS","Thomas","vanderwel","no","male","male","","Gregory","Barsh","male","","Stanford University School of Medicine"
"62","Invasion status and phylogenetic relatedness predict cost of heterospecific pollen receipt: implications for native biodiversity decline","JOURNAL OF ECOLOGY","Gerardo","liao","no","male",NA,"babynames.com","Nicole","Rafferty","female","University of Pittsburgh","University of Arizona"
"63","CodABC: A Computational Framework to Coestimate Recombination, Substitution, and Molecular Adaptation Rates by Approximate Bayesian Computation","MOLECULAR BIOLOGY AND EVOLUTION","Miguel","dobson","no","male","male","","Sergei","Pond","male","Centro de Biologia Molecular Severo Ochoa","Temple University"
"64","Maximum-Likelihood Phylogenetic Inference with Selection on Protein Folding Stability","MOLECULAR BIOLOGY AND EVOLUTION","Miguel","filibeck","no","male","male","","Jeffrey","Thorne","male","Universidad Autónoma de Madrid","North Carolina State University"
"65","Options of partners improve carbon for phosphorus trade in the arbuscular mycorrhizal mutualism","ECOLOGY LETTERS","Alicia","heino","no","female","female","","Hafiz","Maherali","male","University of Zurich","University of Guelph"
"66","The RNAPII-CTD Maintains Genome Integrity through Inhibition of Retrotransposon Gene Expression and Transposition","PLOS GENETICS","Maria","herrero","no","female","female","","Lidia","Vasiljeva","female","University of British Columbia","University of Oxford"
"67","Species co-occurrence analysis: pairwise versus matrix-level approaches","GLOBAL ECOLOGY AND BIOGEOGRAPHY","Hector","jucker","no","male","male","","Pedro","Peres-Neto","male","Universidad Nacional Autonoma de Mexico","Concordia University Montreal"
"68","Experimental evidence for a time-integrated effect of productivity on diversity","ECOLOGY LETTERS","David","karanovic","no","male","male","","Mark","Vellend","male","","Universite de Sherbrooke"
"69","Resource waves: phenological diversity enhances foraging opportunities for mobile consumers","ECOLOGY","Jonathan","karna","no","male","male","","Mark","Hebblewhite","male","University of Wyoming","University of Montana"
"70","Using ecophysiological traits to predict climatic and activity niches: lethal temperature and water loss in Mediterranean ants","GLOBAL ECOLOGY AND BIOGEOGRAPHY","Xavier","lusk","no","male","male","","Alberto","Jimenez-Valverde","male","University Federal Pernambuco","Universidad de Alcala"
"71","Energetic constraint of non-monotonic mass change during offspring growth: a general hypothesis and application of a new tool","JOURNAL OF ANIMAL ECOLOGY","Jennifer","morrison","no","female","female","","Thierry","Boulinier","male","Penn State","CNRS"
"72","Metabarcoding and mitochondrial metagenomics of endogean arthropods to unveil the mesofauna of the soil","METHODS IN ECOLOGY AND EVOLUTION","Paula","orman","no","female","female","","Douglas","Yu","male","Natural History Museum","University of East Anglia "
"73","Disentangling the biogeography of ship biofouling: barnacles in the Northeast Pacific","GLOBAL ECOLOGY AND BIOGEOGRAPHY","G.","peoples","no",NA,NA,"","Marie-Josee","Fortin","female","","University of Toronto"
"74","Independent Neuronal Origin of Seizures and Behavioral Comorbidities in an Animal Model of a Severe Childhood Genetic Epileptic Encephalopathy","PLOS GENETICS","Samuel","peralta","no","male","male","","Gregory","Barsh","male","Jackson Lab","Stanford University School of Medicine"
"75","Testing the mechanisms of diversity-dependent overyielding in a grass species","ECOLOGY","Daniel","stevens","no","either","either","","Jonathan","Levine","male","Virginia Tech","University of California Santa Barbara"
"76","Flexibility in metabolic rate confers a growth advantage under changing food availability","JOURNAL OF ANIMAL ECOLOGY","Sonya","thi nhat quyen tran","no","female","female","","Daniel","Ardia","either","University of Glasgow","Franklin and Marshall University"
"77","Differentiating the Levy walk from a composite correlated random walk","METHODS IN ECOLOGY AND EVOLUTION","Marie","xi","no","female","female","","Luca","Borger","either","University of Alberta","Swansea University"
"78","The Interplay between Myc and CTP Synthase in Drosophila","PLOS GENETICS","Gabriel","caccia","no","either","either","","Kenneth","Moberg","male","University of Oxford","Emory University School of Medicine"
"79","Experimental evidence for fundamental, and not realized, niche partitioning in a plant-herbivore community interaction network","JOURNAL OF ANIMAL ECOLOGY","Willem","dong","no","male","male","","Peter","Hamback","male","University Stellenbosch","University of Stockholm"
"80","Whether in life or in death: fresh perspectives on how plants affect biogeochemical cycling","JOURNAL OF ECOLOGY","Amy","lind","no","female","female","","Richard","Bardgett","male","Consejo National Investment Center","University of Manchester"
"81","Ectomycorrhizal fungi slow soil carbon cycling","ECOLOGY LETTERS","Colin","plasse","no","male","male","","Richard","Bardgett","male","University of Texas","University of Manchester"
"82","Space-use behaviour of woodland caribou based on a cognitive movement model","JOURNAL OF ANIMAL ECOLOGY","Tal","stephens","no","either",NA,"babynames.com","Atle","Mysterud",NA,"University of Guelph","University of Oslo"
"83","Integrated step selection analysis: bridging the gap between resource selection and animal movement","METHODS IN ECOLOGY AND EVOLUTION","Tal","yudell","no","either",NA,"babynames.com","Luca","Borger","either","University of Alberta","Swansea University"
"84","Comparative performance of two whole-genome capture methodologies on ancient DNA Illumina libraries","METHODS IN ECOLOGY AND EVOLUTION","Maria","kuzu","no","female","female","","Michael","Bunce","male","Stanford University","Curtin University"
"85","Quercus suber dieback alters soil respiration and nutrient availability in Mediterranean forests","JOURNAL OF ECOLOGY","Jose","dahirel","no","male","male","","Matthew","Turnbull","male","Instituto de Recursos Naturales","University of Canterbury"
"86","Uncovering Hidden Layers of Cell Cycle Regulation through Integrative Multi-omic Analysis","PLOS GENETICS","Ranen","wang","no",NA,NA,"","Michael","Snyder","male","Tel Aviv University","Stanford University School of Medicine"
"87","Weighted Quartets Phylogenetics","SYSTEMATIC BIOLOGY","Eliran","buser","no","male",NA,"thinkbabynames.com","Tiffani","Williams","female","University of Haifa","Texas A&M University"
"88","Towards a unified descriptive theory for spatial ecology: predicting biodiversity patterns across spatial scales","METHODS IN ECOLOGY AND EVOLUTION","Sandro","liao","no","male","male","","David","Murrell","male","University of Leeds","University College London"
"89","RecG Directs DNA Synthesis during Double-Strand Break Repair","PLOS GENETICS","Benura","rupia","no",NA,NA,"","Justin","Courcelle","either","University of Edinburgh","Oregon State University"
"90","The advantage of the extremes: tree seedlings at intermediate abundance in a tropical forest have the highest richness of above-ground enemies and suffer the most damage","JOURNAL OF ECOLOGY","Benedicte","azeroglu","no","male",NA,"babynames.com","Martin","Heil","male","Columbia University","CINVESTAV-Irapuato"
"91","The Ciliopathy Protein CC2D2A Associates with NINL and Functions in RAB8-MICAL3-Regulated Vesicle Trafficking","PLOS GENETICS","Ruxandra","bardos","no",NA,NA,"","Susan","Dutcher","female","University of Zurich","Washington University School of Medicine"
"92","Genealogical Working Distributions for Bayesian Model Testing with Phylogenetic Uncertainty","SYSTEMATIC BIOLOGY","Guy","cipriotti","no","male","male","","Mark","Holder","male","University of Leuven","University of Kansas"
"93","Environmental heterogeneity has a weak effect on diversity during community assembly in tallgrass prairie","ECOLOGICAL MONOGRAPHS","Sara","godsoe","no","female","female","","Aimee","Classen","female","Southern Illinois University","University of Tennessee"
"94","Disentangling dispersal from phylogeny in the colonization capacity of forest understorey plants","JOURNAL OF ECOLOGY","Lander","gupta","no","male",NA,"babynames.com","James","Cahill","male","University of Ghent","University of Alberta"
"95","A method for analysing replicated point patterns in ecology","METHODS IN ECOLOGY AND EVOLUTION","Robert","lurgi","no","male","male","","David","Murrell","male","ETH Zurich","University College London"
"96","Differential responses of grasses and forbs led to marked reduction in below-ground productivity in temperate steppe following chronic N deposition","JOURNAL OF ECOLOGY","Wenming","muenkemueller","no",NA,NA,"","Rebecca","McCulley","female","Chinese Academy of Sciences","University of Kentucky"
"97","Do sunbirds use taste to decide how much to drink?","JOURNAL OF ANIMAL ECOLOGY","Ida","peris","no","female","female","","Simon","Verhulst","male","University of St. Andrews","University of Groningen"
"98","Tackling extremes: challenges for ecological and evolutionary research on extreme climatic events","JOURNAL OF ANIMAL ECOLOGY","Liam","rayfield","no","male","male","","Fanie","Pelletier",NA,"Australian National University","University of Sherbrooke"
"99","RClone: a package to identify MultiLocus Clonal Lineages and handle clonal data sets in r.","METHODS IN ECOLOGY AND EVOLUTION","Diane","tugrul","no","female","female","","Timothee","Poisot","male","","University of Canterbury"
"100","Microform-scale variations in peatland permeability and their ecohydrological implications","JOURNAL OF ECOLOGY","Andy","herrero","no","either","either","","John","Lee","male","University of Leeds","University of Sheffield"
"101","The Genome Sequence of Saccharomyces eubayanus and the Domestication of Lager-Brewing Yeasts","MOLECULAR BIOLOGY AND EVOLUTION","EmilyClare","del toro","no","female",NA,"first name alone","Jianzhi","Zhang",NA,"University of Wisconsin Madison","University of Michigan"
"102","Consistent, small effects of treefall disturbances on the composition and diversity of four Amazonian forests","JOURNAL OF ECOLOGY","Timothy","pringle","no","male","male","","Gerhard","Zotz","male","University of Leeds","University of Oldenburg"
"103","Y No second chances: demography from the forest floor to the canopy and back again","JOURNAL OF ECOLOGY","Maria","wu","no","female","female","","Lorena","Gomez-Aparicio","female","University of Utrecht","IRNAS-CSIC"
