"","TI","SO","LeadAuthorFirst","LeadAuthorLast","LeadInitOnly","first.gender.manual","first.gender","first.gender.manual.method","EditorFirst","EditorLast","editor.gender.manual","FirstInst2","Editor.Institution"
"1844","Parasites alter freshwater communities in mesocosms by modifying invasive crayfish behavior","ECOLOGY","Lindsey","egan","no","either","either","","Kevin","Lafferty","male","University of Notre Dame","USGS Chanel Islands Field Station"
"1845","High incidence of dioecy in young successional tropical forests","JOURNAL OF ECOLOGY","Maxime","giam","no","female",NA,"babynames.com","Jason","Fridley","male","CNRS CEFE","Syracuse University"
"1846","Point process models for presence-only analysis","METHODS IN ECOLOGY AND EVOLUTION","Ian","herfindal","no","male","male","","Robert","O'Hara","male","University of Newcastle","Biodiversitat und Klima"
"1847","A Return to Linnaeus's Focus on Diagnosis, Not Description: The Use of DNA Characters in the Formal Naming of Species","SYSTEMATIC BIOLOGY","Susanne","jewett","no","female","female","","Tiffani","Williams","female","University of Munich","Texas A&M University"
"1848","Persistence of Subgenomes in Paleopolyploid Cotton after 60 My of Evolution","MOLECULAR BIOLOGY AND EVOLUTION","Simon","konczal","no","male","male","","Susanne","Renner","female","Iowa State University","University of Missouri Saint Louis"
"1849","Temporal context affects the observed rate of climate-driven range shifts in tree species","GLOBAL ECOLOGY AND BIOGEOGRAPHY","Katherine","kranstauber","yes","female","female","","Linda","Beaumont","female","Colorado State University","Macquarie University"
"1850","Local contagion and regional compression: habitat selection drives spatially explicit, multiscale dynamics of colonisation in experimental metacommunities","ECOLOGY LETTERS","William","lin","no","male","male","","Tim","Wootton","either","University of Mississippi","University of Chicago"
"1851","Implications of scaled N-15 fractionation for community predator-prey body mass ratio estimates in size-structured food webs","JOURNAL OF ANIMAL ECOLOGY","Jonathan","losin","no","male","male","","Shai","Meiri","male","University of Washington","Tel Aviv University"
"1852","Forest resilience and tipping points at different spatio-temporal scales: approaches and challenges","JOURNAL OF ECOLOGY","Christopher","marten-rodriguez","no","male","male","","David","Coomes","male","Potsdam Institute of Climate Impact Research","University of Cambridge"
"1853","Forest resilience, tipping points and global change processes","JOURNAL OF ECOLOGY","Christopher","medina","no","male","male","","David","Gibson","male","Potsdam Institute of Climate Impact Research","Southern Illinois University"
"1854","Raccoon contact networks predict seasonal susceptibility to rabies outbreaks and limitations of vaccination","JOURNAL OF ANIMAL ECOLOGY","Jennifer","richman","no","female","female","","Sonia","Altizer","female","University of Minnesota","University of Georgia"
"1855","Modelling heterogeneity among fitness functions using random regression","METHODS IN ECOLOGY AND EVOLUTION","Richard","yen","no","male","male","","Jarrod","Hadfield",NA,"University of Alabama at Birmingham","University of Edinburgh"
"1856","Socially mediated effects of climate change decrease survival of hibernating Alpine marmots","JOURNAL OF ANIMAL ECOLOGY","Celia","bufford","no","female","female","","Thierry","Boulinier","male","Universite Lyon","CNRS"
"1857","The relative value of field survey and remote sensing for biodiversity assessment","METHODS IN ECOLOGY AND EVOLUTION","Christopher","devine","no","male","male","","Robert","Freckleton","male","Lancaster Environmental Center","University of Sheffield"
"1858","Phylogenetic impoverishment of plant communities following chronic human disturbances in the Brazilian Caatinga","ECOLOGY","Elaine","ehlers","no","female","female","","Nathan","Kraft","male","University Federal Pernambuco","University of Maryland"
"1859","Edge effects and geometric constraints: a landscape-level empirical test","JOURNAL OF ANIMAL ECOLOGY","Suzy","gibert","no","female","female","","Peter","Hamback","male","University Federal Rio de Janeiro","University of Stockholm"
"1860","FACT Assists Base Excision Repair by Boosting the Remodeling Activity of RSC","PLOS GENETICS","John","gong","no","male","male","","Marco","Bianchi","male","Universite Grenoble","DIBIT"
"1861","Nectar chemistry mediates the behavior of parasitized bees: consequences for plant fitness","ECOLOGY","Leif","hochner","no","male","male","","Jay","Rosenheim","male","Dartmouth College","University of California Davis"
"1862","Ecological implications of reduced forage quality on growth and survival of sympatric geese","JOURNAL OF ANIMAL ECOLOGY","Samantha","solis-lemus","no","female","female","","Ryan","Norris","male","University of Rhode Island","University of Guelph"
"1863","daf-41/p23: A Small Protein Heating Up Lifespan Regulation","PLOS GENETICS","Klaus","soliveres","no","male","male","","Stuart","Kim","male","Technological University of Munich","Stanford University Medical Center"
"1864","Intrinsic dynamics of the regional community","ECOLOGY LETTERS","Robert","strickland","no","male","male","","Brian","Enquist","male","","University of Arizona"
"1865","Rapid human-induced divergence of life-history strategies in Bahamian livebearing fishes (family Poeciliidae)","JOURNAL OF ANIMAL ECOLOGY","Ruediger","wachsmuth","no",NA,NA,"","Sissel","Jentoft","female","University of London","University of Oslo"
"1866","Climate and the landscape of fear in an African savanna","JOURNAL OF ANIMAL ECOLOGY","Corinna","baudrot","no","female","female","","Ian","Montgomery","male","","Queen's University Belfast"
"1867","Printing soil: a single-step, high-throughput method to isolate micro-organisms and near-neighbour microbial consortia from a complex environmental sample","METHODS IN ECOLOGY AND EVOLUTION","Bradley","cortez","no","male","male","","M","Gilbert",NA,"Naval Research Lab",""
"1868","Fire ecology of C-3 and C-4 grasses depends on evolutionary history and frequency of burning but not photosynthetic type","ECOLOGY","Brad","fukumori","no","male","male","","Jeannine","Cavender-Bares","female","Rhodes University","University of Minnesota"
"1869","Wolves trigger a trophic cascade to berries as alternative food for grizzly bears","JOURNAL OF ANIMAL ECOLOGY","William","kendall","no","male","male","","Ben","Sheldon","male","Oregon State University","University of Oxford"
"1870","Aboveground vertebrate and invertebrate herbivore impact on net N mineralization in subalpine grasslands","ECOLOGY","Anita","zhang","no","female","female","","Matthias","Rillig","male","Swiss Federal Institute of Forest Snow and Landscape Research","Freie University of Berlin"
"1871","Geographic patterns of diversification and the latitudinal gradient of richness of rocky intertidal gastropods: the 'into the tropical museum' hypothesis","GLOBAL ECOLOGY AND BIOGEOGRAPHY","Marcelo","arenas","no","male","male","","Jonathan","Belmaker","male","Center for Estudios Avanzados","Tel Aviv University"
"1872","Leave before it's too late: anthropogenic and environmental triggers of autumn migration in a hunted ungulate population","ECOLOGY","Inger","bielejec","no","female","female","","Heiko","Wittmer","male","University of Oslo","Victoria University of Wellington"
"1873","A Year of Infection in the Intensive Care Unit: Prospective Whole Genome Sequencing of Bacterial Clinical Isolates Reveals Cryptic Transmissions and Novel Microbiota","PLOS GENETICS","David","duchene","no","male","male","","Diamaid","Hughes","male","University of Washington","Uppsala University"
"1874","Distinct Processes Drive Diversification in Different Clades of Gesneriaceae","SYSTEMATIC BIOLOGY","Eric","pang","no","male","male","","Austin","Mast","either","Washington State University","Florida State University"
"1875","Phylo.io: Interactive Viewing and Comparison of Large Phylogenetic Trees on the Web","MOLECULAR BIOLOGY AND EVOLUTION","Oscar","patino","no","male","male","","Michael","Rosenberg","male","University College London","Arizona State University"
"1876","Peatland vascular plant functional types affect methane dynamics by altering microbial community structure","JOURNAL OF ECOLOGY","Bjorn","safavi-hemami","no","male","male","","Nina","Wurzburger","female","University of Utrecht","University of Georgia"
"1877","Acoustic assessment of species richness and assembly rules in ensiferan communities from temperate ecosystems","ECOLOGY","Irene","spielman","no","female","female","","Marc","Urban","male","University of Quebec","University of Connecticut"
"1878","On the Robustness to Gene Tree Estimation Error (or lack thereof) of Coalescent-Based Species Tree Methods","SYSTEMATIC BIOLOGY","Sebastien","xu","no","male","male","","Laura","Kubatko","female","University of Wisconsin Madison","Ohio State University"
"1879","The ecological impacts of marine debris: unraveling the demonstrated evidence from what is perceived","ECOLOGY","Chelsea","castorani","no","female","female","","Peter","Raimondi","male","University of California Davis","University of California Santa Cruz"
"1880","High Recombinant Frequency in Extraintestinal Pathogenic Escherichia coli Strains","MOLECULAR BIOLOGY AND EVOLUTION","Jeronimo","doropoulos","no","male",NA,"babynames.com","Csaba","Pal","male","Instituto de Biomedicina de Sevilla","Institute of biochemistry"
"1881","Marine nano- and microphytoplankton diversity: redrawing global patterns from sampling-standardized data","GLOBAL ECOLOGY AND BIOGEOGRAPHY","Tamara","fronhofer","no","female","female","","Michael","Rex","male","University of Vigo","University of Massachusetts Boston"
"1882","Effects of multiple dimensions of bacterial diversity on functioning, stability and multifunctionality","ECOLOGY","Fabian","hanley","no","male","male","","Steven","Allison","male","University of Gothenburg","University of California Irvine"
"1883","Chromosomal Rearrangements as Barriers to Genetic Homogenization between Archaic and Modern Humans","MOLECULAR BIOLOGY AND EVOLUTION","Rebekah","kroeker","no","female","female","","Yuseob","Kim",NA,"University of California Berkeley","Ewha Womans University"
"1884","Phylogenetic ANOVA: The Expression Variance and Evolution Model for Quantitative Trait Evolution","SYSTEMATIC BIOLOGY","Rori","monaco","no","female","female","","Luke","Harmon","male","University of California Berkeley","University of Idaho"
"1885","The RTR Complex Partner RMI2 and the DNA Helicase RTEL1 Are Both Independently Involved in Preserving the Stability of 45S rDNA Repeats in Arabidopsis thaliana","PLOS GENETICS","Sarah","okamoto","no","female","female","","Abraham","Levy","male","Karlsruhe Institute of Technology","Weizmann Institute"
"1886","Bats (Chiroptera: Noctilionoidea) Challenge a Recent Origin of Extant Neotropical Diversity","SYSTEMATIC BIOLOGY","Danny","romero-romero","no","either","either","","Robb","Brumfield","male","University of Aveiro","Louisiana State University"
"1887","Structural and Genetic Studies Demonstrate Neurologic Dysfunction in Triosephosphate Isomerase Deficiency Is Associated with Impaired Synaptic Vesicle Dynamics","PLOS GENETICS","Bartholomew","st clair","no","male","male","","Leo","Pallanck","male","University of Pittsburgh","University of Washington"
"1888","Pivotal effect of early-winter temperatures and snowfall on population growth of alpine Parnassius smintheus butterflies","ECOLOGICAL MONOGRAPHS","Jens","bailey","no","male","male","","Jessica","Forrest","female","University of Alberta","University of Ottawa"
"1889","Linking vertebrate species richness to tree canopy height on a global scale","GLOBAL ECOLOGY AND BIOGEOGRAPHY","Uri","bowers","yes","male","male","","Gavin","Thomas","male","University of Oxford","University of Sheffield"
"1890","Dispersal is a major driver of the latitudinal diversity gradient of Carnivora","GLOBAL ECOLOGY AND BIOGEOGRAPHY","Jonathan","duijns","no","male","male","","Gary","Mittelbach","male","University of Lausanne","Michigan State University"
"1891","Niche width impacts vertebrate diversification","GLOBAL ECOLOGY AND BIOGEOGRAPHY","Jonathan","gossner","no","male","male","","Brody","Sandel","male","University of Lausanne","Santa Clara University"
"1892","Selection on Mitochondrial Variants Occurs between and within Individuals in an Expanding Invasion","MOLECULAR BIOLOGY AND EVOLUTION","Lee","haugen","no","either","either","","Joshua","Akey","male","Deakin University","University of Washington"
"1893","Interspecific variation in growth responses to climate and competition of five eastern tree species","ECOLOGY","Christine","kersch-becker","no","female","female","","John","Battles","male","Penn State","University of California Berkeley"
"1894","Body size-based trophic structure of a deep marine ecosystem","ECOLOGY","Sonia","kervinen","no","female","female","","Sergio","Navarrete","male","University of Oviedo","Pontificia Universidad Catolica de Chile"
"1895","Food web structure shaped by habitat size and climate across a latitudinal gradient","ECOLOGY","Gustavo","macleod","no","male","male","","Leon","Lounibos","male","University of Campinas","University of Florida"
"1896","Phylogenomics Controlling for Base Compositional Bias Reveals a Single Origin of Eusociality in Corbiculate Bees","MOLECULAR BIOLOGY AND EVOLUTION","Jonathan","paquet","no","male","male","","Andrew","Roger","male","University of Lausanne","Dalhousie University"
"1897","Community assembly on isolated islands: macroecology meets evolution","GLOBAL ECOLOGY AND BIOGEOGRAPHY","A.","schlicht","no",NA,NA,"","Robert","Ricklefs","male","University of California Berkeley","University of Missouri Saint Louis"
"1898","Deterministic and stochastic processes lead to divergence in plant communities 25 years after the 1988 Yellowstone fires","ECOLOGICAL MONOGRAPHS","William","stojanovic","no","male","male","","Gordon","Fox","male","Colorado State University","University of South Florida"
"1899","Increasing the power of genome wide association studies in natural populations using repeated measures - evaluation and implementation","METHODS IN ECOLOGY AND EVOLUTION","Lars","valimaki","no","male","male","","Robert","Freckleton","male","Swedish University of Agricultural Sciences","University of Sheffield"
"1900","How do climate and topography influence the greening of the forest-tundra ecotone in northern Quebec? A dendrochronological analysis of Betula glandulosa","JOURNAL OF ECOLOGY","Pascale","hahn","no","male","male","","Richard","Bardgett","male","Universite Laval","University of Manchester"
"1901","Phylogenetic endemism in terrestrial mammals","GLOBAL ECOLOGY AND BIOGEOGRAPHY","Dan","mischler","no","male","male","","Shai","Meiri","male","Yale University","Tel Aviv University"
"1902","Does allochthony in lakes change across an elevation gradient?","ECOLOGY","Kevin","west","no","male","male","","Donald","Strong","male","University of Wisconsin Madison","University of California Davis"
"1903","Relationship between growth and standard metabolic rate: measurement artefacts and implications for habitat use and life-history adaptation in salmonids","JOURNAL OF ANIMAL ECOLOGY","Jordan","borg","no","either","either","","Joseph","Rasmussen","male","University of British Columbia","University of Lethbridge"
"1904","Unifying ecology and macroevolution with individual-based theory","ECOLOGY LETTERS","James","hoy","no","male","male","","Arne","Mooers","male","Imperial College London","Simon Fraser University"
"1905","Paternal Mitochondrial Transmission in Intra-Species Caenorhabditis briggsae Hybrids","MOLECULAR BIOLOGY AND EVOLUTION","Joseph","neuschulz","no","male","male","","Ilya","Ruvinsky","male","California State University Fresno","University of Chicago"
"1906","A two-species occupancy model accommodating simultaneous spatial and interspecific dependence","ECOLOGY","Christopher","des marais","no","male","male","","Helene","Wagner","female","University of Missouri","University of Toronto"
"1907","Bacterial endosymbionts protect aphids in the field and alter parasitoid community composition","ECOLOGY","Lukas","eskelinen","no","male","male","","William","Snyder","male","ETH Zurich","Washington State University"
"1908","The challenges of the first migration: movement and behaviour of juvenile vs. adult white storks with insights regarding juvenile mortality","JOURNAL OF ANIMAL ECOLOGY","Shay","gossmann","no","either","either","","Christiaan","Both","male","Hebrew University of Jerusalem","University of Groningen"
"1909","A Photoreceptor Contributes to the Natural Variation of Diapause Induction in Daphnia magna","MOLECULAR BIOLOGY AND EVOLUTION","Anne","hamann","no","female","female","","John","TRUE","male","University of Basel","Stony Brook University"
"1910","The distribution and diversity of insular ants: do exotic species play by different rules?","GLOBAL ECOLOGY AND BIOGEOGRAPHY","Nuria","irwin","no","female",NA,"babynames.com","Katrin","Bohning-Gaese","female","University of Girona","Senckenberg Biodiversity and Climate Research Centre"
"1911","Revisiting the hypothesis that fungal-to-bacterial dominance characterizes turnover of soil organic matter and nutrients","ECOLOGICAL MONOGRAPHS","Johannes","lawson","no","male","male","","Joseph","Yavitt","male","Lund University","Cornell University"
"1912","Scaling mangrove aboveground biomass from site-level to continental-scale","GLOBAL ECOLOGY AND BIOGEOGRAPHY","A.","liow","no",NA,NA,"","David","Currie","male","University Federal Santa Catarina","University of Ottawa"
"1913","Is Genome Complexity a Consequence of Inefficient Selection? Evidence from Intron Creation in Nonrecombining Regions","MOLECULAR BIOLOGY AND EVOLUTION","Scott","luthringer","no","male","male","","Gregory","Wray","male","San Francisco State University","Duke University"
"1914","How Common Is Parallel Intron Gain? Rapid Evolution Versus Independent Creation in Recently Created Introns in Daphnia","MOLECULAR BIOLOGY AND EVOLUTION","Scott","manzanares","no","male","male","","Miriam","Barlow","female","San Francisco State University","University of California Merced"
"1915","Varying predator personalities generates contrasting prey communities in an agroecosystem","ECOLOGY","Raphael","metz","no","male","male","","William","Snyder","male","North Carolina State University","Washington State University"
"1916","Evaluating the ecological impacts of salvage logging: can natural and anthropogenic disturbances promote coexistence?","ECOLOGY","Alejandro","neumann","no","male","male","","Anthony","D'Amato","male","USFS Northern Research Station","University of Vermont"
"1917","The functional extinction of Andean megafauna","ECOLOGY","Angela","sun","no","female","female","","Jennifer","Gill","female","Florida Institute of Technology","University of East Anglia"
"1918","Informed herbivore movement and interplant communication determine the effects of induced resistance in an individual-based model","JOURNAL OF ANIMAL ECOLOGY","Ilan","thompson","no",NA,NA,"","Tim","Coulson","either","Cornell University","University of Oxford"
"1919","Fungal symbiont effects on dune plant diversity depend on precipitation","JOURNAL OF ECOLOGY","Jennifer","wright","no","female","female","","Gerlinde","DeDeyn","female","University of New Mexico","Wageningen University"
"1920","Terrestrial origin of bacterial communities in complex boreal freshwater networks","ECOLOGY LETTERS","Clara","zhang","no","female","female","","Noah","Fierer","male","University of Quebec","University of Colorado"
"1921","The quality of organic matter shapes the functional biogeography of bacterioplankton across boreal freshwater ecosystems","GLOBAL ECOLOGY AND BIOGEOGRAPHY","Clara","yang","no","female","female","","Janne","Soininen",NA,"University of Quebec","University of Helsinki"
"1922","Uncertainty in biological monitoring: a framework for data collection and analysis to account for multiple sources of sampling bias","METHODS IN ECOLOGY AND EVOLUTION","Viviana","allen","no","female","female","","Nigel","Yoccoz","male","Colorado State University","University of Tromso"
"1923","Stable coexistence of ecologically identical species: conspecific aggregation via reproductive interference","JOURNAL OF ANIMAL ECOLOGY","Lasse","brenden","no",NA,NA,"","Jean-Michel","Gaillard","male","University of Helsinki","CNRS"
"1924","Fight-flight or freeze-hide? Personality and metabolic phenotype mediate physiological defence responses in flatfish","JOURNAL OF ANIMAL ECOLOGY","Emmanuel","byers","no","male","male","","Julie","Morand-Ferron","either","","University of Ottawa"
"1925","Habitat features and long-distance dispersal modify the use of social information by a long-distance migratory bird","JOURNAL OF ANIMAL ECOLOGY","Clark","cardoso","no","male","male","","Michael","Wunder","male","University of Maryland","University of Colorado Denver"
"1926","Winter habitat quality but not long-distance dispersal influences apparent reproductive success in a migratory bird","ECOLOGY","Clark","cline","no","male","male","","Walter","Koenig","male","","Cornell University"
"1927","Climate and habitat interact to shape the thermal reaction norms of breeding phenology across lizard populations","JOURNAL OF ANIMAL ECOLOGY","Alexis","de nesnera","no","either","either","","Tim","Coulson","either","CNRS Station Ecology Experimental","University of Oxford"
"1928","Plant-soil feedback in East-African savanna trees","ECOLOGY","Gemma","fanin","no","female",NA,"babynames.com","Ken","Paige","male","University of Bern","University of Illinois"
"1929","Calibrating animal-borne proximity loggers","METHODS IN ECOLOGY AND EVOLUTION","Christian","kaldhusdal","no","either","either","","Nicolas","Lecomte","male","University of Oxford","Universite de Moncton"
"1930","Imperfect prey selectivity of predators promotes biodiversity and irregularity in food webs","ECOLOGY LETTERS","Alexey","lange","no","male",NA,"babynames.com","Gregor","Fussmann","male","Carl von Ossietzky University","McGill University"
"1931","Bacterial community response to changes in a tri-trophic cascade during a whole-lake fish manipulation","ECOLOGY","J.","liao","no",NA,NA,"","Ellen","vanDonk","female","University of Jyvaskyla","Netherlands Institute of Ecology"
"1932","Seeing the forest beyond the trees","GLOBAL ECOLOGY AND BIOGEOGRAPHY","Sassan","mcclanahan","yes",NA,NA,"","Jeremy","Kerr","male","Jet Propulsion Lab","University of Ottawa"
"1933","Seasonal species interactions minimize the impact of species turnover on the likelihood of community persistence","ECOLOGY","Serguei","neuheimer","yes",NA,NA,"","Lewi","Stone","male","Estacion Biologica de Donana","Tel Aviv University"
"1934","The epidemiology and evolution of parasite transmission through cannibalism","ECOLOGY","Asaf","pan","no","male",NA,"thenamemeaning.com","Burt","Kotler","male","Hebrew University of Jerusalem","Ben-Gurion University of the Negev"
"1935","Cannibalism amplifies the spread of vertically transmitted pathogens","ECOLOGY","Asaf","peipoch","no","male",NA,"thenamemeaning.com","William","Snyder","male","Hebrew University of Jerusalem","Washington State University"
"1936","Venom Insulins of Cone Snails Diversify Rapidly and Track Prey Taxa","MOLECULAR BIOLOGY AND EVOLUTION","Helena","pennell","no","female","female","","Sergei","Kosakovsky","male","University of Utah","Temple University"
"1937","Rapid adaptation to controlling new microbial epibionts in the invaded range promotes invasiveness of an exotic seaweed","JOURNAL OF ECOLOGY","Mahasweta","raimondi","no","female",NA,"indiachildnames.com","Carol","Thornber","female","","University of Rhode Island"
"1938","The Impact of Environmental and Endogenous Damage on Somatic Mutation Load in Human Skin Fibroblasts","PLOS GENETICS","Natalie","roger","no","female","female","","Martin","Taylor","male","","University of Edinburgh"
"1939","Digestive capacity predicts diet diversity in Neotropical frugivorous bats","JOURNAL OF ANIMAL ECOLOGY","Romeo","civitello","no","male","male","","Alice","Hughes","female","","Chinese Academy of Sciences"
"1940","COMADRE: a global data base of animal demography","JOURNAL OF ANIMAL ECOLOGY","Roberto","fronhofer","no","male","male","","Tim","Coulson","either","Max Planck Institute of Demographic Research","University of Oxford"
"1941","The COMPADRE Plant Matrix Database: an open online repository for plant demography","JOURNAL OF ECOLOGY","Roberto","gordon","no","male","male","","Mark","Rees","male","Max Planck Institute of Demographic Research","University of Sheffield"
"1942","The ghosts of selection past reduces the probability of plastic rescue but increases the likelihood of evolutionary rescue to novel stressors in experimental populations of wild yeast","ECOLOGY LETTERS","Pedram","haileselasie","no",NA,NA,"","Tim","Coulson","either","McGill University","University of Oxford"
"1943","Species introductions and the phylogenetic and functional structure of California's grasses","ECOLOGY","Brody","izhar","no","male","male","","Nathan","Kraft","male","Aarhus University","University of Maryland"
"1944","Defensive insect symbiont leads to cascading extinctions and community collapse","ECOLOGY LETTERS","Dirk","jennings","no","male","male","","Rampal","Etienne",NA,"University of Exeter","University of Groningen"
"1945","Individual and species-specific traits explain niche size and functional role in spiders as generalist predators","JOURNAL OF ANIMAL ECOLOGY","Dirk","kim","no","male","male","","Ben","Woodcock","male","Institute of Ecology and Evolution Bern","Centre for Ecology and Hydrology"
"1946","Impacts of Terraces on Phylogenetic Inference","SYSTEMATIC BIOLOGY","Michael","van allen","no","male","male","","Laura","Kubatko","female","University of Arizona","Ohio State University"
